{
  "schema_version": "1.4",
  "artifact_hash": "beec746754172e439c86f5dee7d068f592f908c5d20bbe2cf0c3aa37fe713710",
  "package_hash": "946afbe36918e679060320abc48eba2cd901d2a2bced48a46e8110af57392be3",
  "results": [
    {
      "schema_version": "1.4",
      "candidate": {
        "schema_version": "1.4",
        "claim_id": "summary_claim:1",
        "source_family": "summary",
        "text": "In 2021, U.S. clothing purchasers aged 18+ had 77% online penetration before and 83% after the outbreak ends.",
        "text_hash": "6459d3e82ee707e013995ddbeb7adb5d9e52d36cc4951035ec334e49251749e7",
        "kind": "numeric",
        "factual": true,
        "evidence_references": [
          {
            "schema_version": "1.4",
            "evidence_id": "online-penetration-clothing",
            "source_pack": "findings",
            "page": null,
            "text_hash": "d53774b1a94d156a70fa14390cfd227c886f37038ec771254d88fc40165f7e74"
          },
          {
            "schema_version": "1.4",
            "evidence_id": "online-penetration-clothing",
            "source_pack": "findings",
            "page": 5,
            "text_hash": "d53774b1a94d156a70fa14390cfd227c886f37038ec771254d88fc40165f7e74"
          }
        ],
        "affected_section": "summary.claim_evidence_map:1.claim",
        "entity_id": "summary_claim:1",
        "provenance_hash": "50eaf1fef20232e3a11feb98b9849c6ce39b0a3dbf9611bc7321e202e08dbbff"
      },
      "checks": [
        {
          "schema_version": "1.4",
          "name": "evidence_reference_completeness",
          "status": "passed",
          "reason": "evidence_reference_present"
        },
        {
          "schema_version": "1.4",
          "name": "number_value_unit_match",
          "status": "passed",
          "reason": "quantities_matched"
        }
      ],
      "status": "supported",
      "deterministic_status": "supported",
      "reasons": [],
      "protected_facts": {
        "schema_version": "1.0",
        "proposition_status": "unknown",
        "dimensions": {
          "value": {
            "schema_version": "1.0",
            "claim_value": "18.0, 77.0, 83.0",
            "evidence_value": "18.0, 19.0, 77.0, 83.0",
            "status": "compatible"
          },
          "unit_currency": {
            "schema_version": "1.0",
            "claim_value": "percent",
            "evidence_value": "percent, unknown",
            "status": "compatible"
          },
          "magnitude": {
            "schema_version": "1.0",
            "claim_value": null,
            "evidence_value": null,
            "status": "unknown"
          },
          "direction": {
            "schema_version": "1.0",
            "claim_value": null,
            "evidence_value": null,
            "status": "unknown"
          },
          "timeframe": {
            "schema_version": "1.0",
            "claim_value": null,
            "evidence_value": null,
            "status": "unknown"
          },
          "geography": {
            "schema_version": "1.0",
            "claim_value": "us",
            "evidence_value": "us",
            "status": "compatible"
          },
          "population": {
            "schema_version": "1.0",
            "claim_value": null,
            "evidence_value": null,
            "status": "unknown"
          },
          "comparison": {
            "schema_version": "1.0",
            "claim_value": null,
            "evidence_value": null,
            "status": "unknown"
          },
          "observation_status": {
            "schema_version": "1.0",
            "claim_value": null,
            "evidence_value": null,
            "status": "unknown"
          },
          "attribution": {
            "schema_version": "1.0",
            "claim_value": null,
            "evidence_value": null,
            "status": "unknown"
          },
          "certainty": {
            "schema_version": "1.0",
            "claim_value": null,
            "evidence_value": null,
            "status": "unknown"
          },
          "causality": {
            "schema_version": "1.0",
            "claim_value": null,
            "evidence_value": null,
            "status": "unknown"
          }
        }
      },
      "semantic_outcome": null,
      "semantic_reason": "",
      "semantic_protected_facts": null,
      "semantic_identity": null,
      "semantic_disagreement": "",
      "semantic_validator_used": false,
      "semantic_execution_identity": ""
    },
    {
      "schema_version": "1.4",
      "candidate": {
        "schema_version": "1.4",
        "claim_id": "summary_claim:2",
        "source_family": "summary",
        "text": "In the U.S. 2021 chart, online penetration among grocery purchasers aged 18+ was 43% before the outbreak began and 56% after it ends.",
        "text_hash": "d5f35018971e55f095a0d7e678e766037773dfdd175b8e73dcd8cab590b548e3",
        "kind": "numeric",
        "factual": true,
        "evidence_references": [
          {
            "schema_version": "1.4",
            "evidence_id": "online-penetration-grocery",
            "source_pack": "findings",
            "page": null,
            "text_hash": "21e8302828336e70b73ca74b65236f5710d00e7f26d24c649e1aed44cff6ca35"
          },
          {
            "schema_version": "1.4",
            "evidence_id": "online-penetration-grocery",
            "source_pack": "findings",
            "page": 5,
            "text_hash": "21e8302828336e70b73ca74b65236f5710d00e7f26d24c649e1aed44cff6ca35"
          }
        ],
        "affected_section": "summary.claim_evidence_map:2.claim",
        "entity_id": "summary_claim:2",
        "provenance_hash": "f62a92328d25aed4799770a22afee980299d4ce3a59b5c67c0f1602ea164630b"
      },
      "checks": [
        {
          "schema_version": "1.4",
          "name": "evidence_reference_completeness",
          "status": "passed",
          "reason": "evidence_reference_present"
        },
        {
          "schema_version": "1.4",
          "name": "number_value_unit_match",
          "status": "passed",
          "reason": "quantities_matched"
        }
      ],
      "status": "supported",
      "deterministic_status": "supported",
      "reasons": [],
      "protected_facts": {
        "schema_version": "1.0",
        "proposition_status": "unknown",
        "dimensions": {
          "value": {
            "schema_version": "1.0",
            "claim_value": "18.0, 43.0, 56.0",
            "evidence_value": "18.0, 19.0, 43.0, 56.0",
            "status": "compatible"
          },
          "unit_currency": {
            "schema_version": "1.0",
            "claim_value": "percent",
            "evidence_value": "percent, unknown",
            "status": "compatible"
          },
          "magnitude": {
            "schema_version": "1.0",
            "claim_value": null,
            "evidence_value": null,
            "status": "unknown"
          },
          "direction": {
            "schema_version": "1.0",
            "claim_value": null,
            "evidence_value": null,
            "status": "unknown"
          },
          "timeframe": {
            "schema_version": "1.0",
            "claim_value": null,
            "evidence_value": null,
            "status": "unknown"
          },
          "geography": {
            "schema_version": "1.0",
            "claim_value": "us",
            "evidence_value": "us",
            "status": "compatible"
          },
          "population": {
            "schema_version": "1.0",
            "claim_value": null,
            "evidence_value": null,
            "status": "unknown"
          },
          "comparison": {
            "schema_version": "1.0",
            "claim_value": null,
            "evidence_value": null,
            "status": "unknown"
          },
          "observation_status": {
            "schema_version": "1.0",
            "claim_value": null,
            "evidence_value": null,
            "status": "unknown"
          },
          "attribution": {
            "schema_version": "1.0",
            "claim_value": null,
            "evidence_value": null,
            "status": "unknown"
          },
          "certainty": {
            "schema_version": "1.0",
            "claim_value": null,
            "evidence_value": null,
            "status": "unknown"
          },
          "causality": {
            "schema_version": "1.0",
            "claim_value": null,
            "evidence_value": null,
            "status": "unknown"
          }
        }
      },
      "semantic_outcome": null,
      "semantic_reason": "",
      "semantic_protected_facts": null,
      "semantic_identity": null,
      "semantic_disagreement": "",
      "semantic_validator_used": false,
      "semantic_execution_identity": ""
    },
    {
      "schema_version": "1.4",
      "candidate": {
        "schema_version": "1.4",
        "claim_id": "summary_claim:3",
        "source_family": "summary",
        "text": "In the U.S. 2021 chart, online penetration among beauty/grooming purchasers aged 18+ was 57% before the outbreak began and 66% after it ends.",
        "text_hash": "29c7114be2e315a1904af914beb44d35f792bdebe2dbebc3cc35dc1203c4fcb2",
        "kind": "numeric",
        "factual": true,
        "evidence_references": [
          {
            "schema_version": "1.4",
            "evidence_id": "online-penetration-beauty-grooming",
            "source_pack": "findings",
            "page": null,
            "text_hash": "f0465e877938b200b8d5a31c6ae7335461668c9d43d34a0b527e4d7ffe3592d5"
          },
          {
            "schema_version": "1.4",
            "evidence_id": "online-penetration-beauty-grooming",
            "source_pack": "findings",
            "page": 5,
            "text_hash": "f0465e877938b200b8d5a31c6ae7335461668c9d43d34a0b527e4d7ffe3592d5"
          }
        ],
        "affected_section": "summary.claim_evidence_map:3.claim",